{
  "$schema": "../../schemas/cloud.schema.json",
  "schema_version": "0.1.0",
  "id": "azure",
  "display_name": "Microsoft Azure",
  "implementation_status": "active",
  "infrastructure_options": [
    "terraform",
    "bicep"
  ],
  "initial_service_ids": [
    "azure_functions",
    "storage",
    "application_insights",
    "log_analytics",
    "monitor_alerts",
    "container_apps",
    "container_instances",
    "container_registry",
    "app_service",
    "virtual_machines",
    "aks",
    "ai_search",
    "azure_openai",
    "ai_foundry",
    "cosmos_db",
    "sql_database",
    "postgresql",
    "event_grid",
    "event_hubs",
    "service_bus",
    "logic_apps",
    "api_management",
    "key_vault",
    "sentinel",
    "azure_policy",
    "virtual_network",
    "private_link",
    "nat_gateway",
    "application_gateway",
    "front_door",
    "azure_firewall",
    "azure_devops"
  ]
}
